{"$schema":"https://json-schema.org/draft/2020-12/schema","type":"object","additionalProperties":false,"required":["schema_version","pipeline","mode","llm_enabled","backend","force_refresh","workspace_id","report_date","timezone","window_start","window_end","hours","example_mode","synthesis","delivery_requested","parent_run_id","schedule_key"],"properties":{"schema_version":{"const":1},"pipeline":{"enum":["market","self"]},"mode":{"enum":["host","headless"]},"llm_enabled":{"type":"boolean"},"backend":{"type":["string","null"]},"force_refresh":{"type":"boolean"},"workspace_id":{"type":"string","pattern":"^[a-f0-9]{16}$"},"report_date":{"type":"string","format":"date"},"timezone":{"type":"string"},"window_start":{"type":"string","format":"date-time"},"window_end":{"type":"string","format":"date-time"},"hours":{"type":"integer","minimum":1,"maximum":720},"example_mode":{"type":"boolean"},"synthesis":{"type":"object"},"delivery_requested":{"type":"boolean"},"parent_run_id":{"type":["string","null"]},"schedule_key":{"type":["string","null"]}}}
