{
  "schema_version": 1,
  "pipeline": "market",
  "mode": "host",
  "workspace_id": "0123456789abcdef",
  "report_date": "2026-09-15",
  "timezone": "Asia/Seoul",
  "window_start": "2026-09-13T01:00:00Z",
  "window_end": "2026-09-15T01:00:00Z",
  "hours": 48,
  "example_mode": true,
  "synthesis": {
    "strategy": "single",
    "enrichment": "off",
    "budget": {
      "max_calls": 3,
      "max_parallel": 1,
      "job_timeout_seconds": 180,
      "run_timeout_seconds": 600,
      "max_input_bytes": 120000,
      "max_output_bytes": 1000000,
      "max_repairs": 1
    }
  },
  "delivery_requested": false,
  "parent_run_id": null,
  "schedule_key": null,
  "llm_enabled": true,
  "backend": null,
  "force_refresh": false
}
